<?xml version="1.0" encoding="UTF-8"?>
<modifications xmlns:xsi="http://www.w3.org/2001/XMLSchema-instance"
               xsi:noNamespaceSchemaLocation="modifications.xsd">    
	<modification>
        <name>iTRAQ4plex114</name>
        <monoIsotopicMassShift>144.105919</monoIsotopicMassShift>
        <averageMassShift>144.105919</averageMassShift>
        <location>any</location>
        <affectedAminoAcids>
            <affectedAminoAcid>K</affectedAminoAcid>
        </affectedAminoAcids>
        <accession>MOD:01485</accession>
        <accessionValue>iTRAQ4plex-114 reporter+balance reagent acylated residue</accessionValue>
    </modification>
    <modification>
        <name>N_term_iTRAQ4plex114oo</name>
        <monoIsotopicMassShift>144.105919</monoIsotopicMassShift>
        <averageMassShift>144.105919</averageMassShift>
        <location>N-terminus</location>
        <affectedAminoAcids>
            <affectedAminoAcid>G</affectedAminoAcid>
            <affectedAminoAcid>L</affectedAminoAcid>
        </affectedAminoAcids>
        <accession>MOD:01485lll</accession>
        <accessionValue>N_term_iTRAQ4plex-114 reporter+balance reagent acylated residueiojijij</accessionValue>
    </modification>
</modifications>